<?xml version="1.0" encoding="UTF-8" ?>

<!--old beans-->
<beans  xmlns:xsi="http://www.w3.org/2001/XMLSchema-instance"
        xsi:noNamespaceSchemaLocation="beans_rules.xsd">
    <bean id="someProduct" class="controller.test_services.Product"/>
   <bean id="basket" class="controller.test_services.Basket">
        <property name="position" value="2"/>
        <property name="addProduct" ref="testAddProduct"/>
    </bean>

    <bean id="testAddProduct" class="controller.test_services.TestAddProduct">
        <property name="product" ref="someProduct1"/>
    </bean>

    <bean id="someProduct1" class="controller.test_services.Product">
        <property name="id" value="555"/>
        <property name="type" value="computer"/>
    </bean>
    <!--_____________________________________________-->
    <bean id="ProductManager" class="controller.test_services.ProductManager"/>


</beans>